{"schema":"rete/1","params":{"ppm":10,"min_fragments":0},"parent":1,"columns":2,"nodes":[{"id":1,"row":0,"mz":317.1642,"rt":5,"neutral_formula":"C13H24N4O3S","ion_formula":"C13H25N4O3S","kinship":0,"step":0,"pos":0},{"id":5,"row":4,"mz":275.1172,"rt":3,"neutral_formula":"C10H18N4O3S","ion_formula":"C10H19N4O3S","kinship":2,"step":1,"pos":0},{"id":4,"row":3,"mz":315.1485,"rt":5.5,"neutral_formula":"C13H22N4O3S","ion_formula":"C13H23N4O3S","kinship":3,"step":1,"pos":1},{"id":2,"row":1,"mz":333.1591,"rt":4.5,"neutral_formula":"C13H24N4O4S","ion_formula":"C13H25N4O4S","kinship":3,"step":1,"pos":2},{"id":3,"row":2,"mz":349.154,"rt":4,"neutral_formula":"C13H24N4O5S","ion_formula":"C13H25N4O5S","kinship":2,"step":1,"pos":3}],"arcs":[{"from":1,"to":2,"rule":"hydroxylation","scope":"generic","delta":"+O","dm":15.99491,"ppm":0,"delta_rt":-0.5,"kinetic":"consistent","ms2":{"equal":[100.1,116.2,130.1],"shifted":[132.2,146.1],"n_equal":3,"n_shifted":2},"reason":"shares 5 fragments, 2 shifted by +15.995; the source peaks first"},{"from":1,"to":3,"rule":"dihydroxylation","scope":"generic","delta":"+2O","dm":31.98983,"ppm":0,"delta_rt":-1,"kinetic":"consistent","ms2":null,"reason":"mass difference +2O of rule dihydroxylation; the source peaks first"},{"from":1,"to":4,"rule":"dehydrogenation","scope":"generic","delta":"−2H","dm":-2.01565,"ppm":0,"delta_rt":0.5,"kinetic":"consistent","ms2":null,"reason":"mass difference −2H of rule dehydrogenation; the source peaks first"},{"from":1,"to":5,"rule":"loss_of_propene_n_deisopropylation","scope":"class","delta":"−3C−6H","dm":-42.04695,"ppm":0,"delta_rt":-2,"kinetic":"consistent","ms2":{"equal":[100.1],"shifted":[],"n_equal":1,"n_shifted":0},"reason":"shares 1 fragment, 0 shifted by −42.047; the source peaks first"},{"from":2,"to":3,"rule":"hydroxylation","scope":"generic","delta":"+O","dm":15.99491,"ppm":0,"delta_rt":-0.5,"kinetic":"consistent","ms2":null,"reason":"mass difference +O of rule hydroxylation; the source peaks first"},{"from":2,"to":4,"rule":"dehydration","scope":"generic","delta":"−2H−O","dm":-18.01056,"ppm":0,"delta_rt":1,"kinetic":"consistent","ms2":null,"reason":"mass difference −2H−O of rule dehydration; the source peaks first"}],"n_arcs":6}